brand,description,price,colour,colour_simp,colour_simp2
Topshop,Vestido playero sin mangas con cuello tipo polo de Topshop,"20,79 €",descolorido,,
Topshop,Vestido vaquero descolorido con cuello halter y volantes de Topshop,"27,50 €",descolorido,,
ASOS DESIGN,Vestido de tarde midi de manga corta con detalle anudado y estampado floral Mix & Match de ASOS DESIGN,"24,74 €",mezcla floral,,
Whistles,Vestido de tarde largo verdeo neón de manga larga a cuadros vichy de Whistles,"69,99 €",cuadros vichy neon,,
Topshop Petite,Vestido corto azul cobalto con abertura y parte delantera retorcida de punto de Topshop Petite,"11,54 €",cobalto,,
ONLY,"Vestido largo rojo y violeta con mangas abullonadas, bajo escalonado y estampado floral de Only","16,39 €",flores brillantes,,
Bailey Rose,Vestido color aguacate ajustado de manga larga con abertura de Bailey Rose,"24,99 €",aguacate,,
Vero Moda,Vestido corto amplio y escalonado de tirantes con estampado a cuadros variados de Vero Moda,"16,00 €",cuadros,,
Vero Moda,Vestido corto azul estilo camiseta con aberturas laterales FRSH de Vero Moda,"6,00 €",jacinto,,
French Connection,Vestido midi beis de punto Manhatten de French Connection,"24,50 €",truffle,,
AsYou,Vestido corto color aguamarina asimétrico de tirantes de ASYOU,"10,00 €",aguamarina,,
Only Petite,"Vestido corto con estampado floral luminoso, abertura y detalle retorcido en la parte delantera de Only Petite","10,00 €",flores brillantes,,
ASOS Petite,"Vestido corto con estampado floral intenso, detalle de anilla y acabado texturizado de ASOS DESIGN Petite","16,00 €",flores tono pastel,,
Missguided,Vestido camisero corto color champán con detalle de corsé de satén de Missguided,"30,79 €",champan,,
French Connection,Vestido violeta con parte delantera drapeada Tirsa de French Connection,"54,00 €",decadence,,
Topshop,Vestido camisero corto color ocre cómodo de tejido texturizado de Topshop,"27,00 €",ocre,,
Nobody's Child,Vestido midi rosado de manga corta con estampado de lunares Selina de Nobody's Child,"48,44 €",rubor,,
Fashion Union,Vestido corto escalonado a cuadros dameros de Fashion Union,"26,50 €",tablero,,
Fashion Union,Vestido corto amplio con sisas caídas de tejido texturizado de Fashion Union,"22,50 €",textura blanca,,
Wednesday's Girl,Vestido de tarde corto cruzado con estampado de lunares de Wednesday's Girl,"10,00 €",lunares variados,,
ASOS DESIGN,Vestido playero corto fruncido con tiras en la espalda y diseño de hilos mezclados de punto ligero de ASOS DESIGN,"14,00 €",tenido espacial,,
Motel,"Vestido corto ajustado con estampado óptico retro, botones y aberturas de Motel","11,50 €",cuadrados opticos,,
Levi's,Vestido azul con cuello subido y logo de punto de Levi's,"39,00 €",delft,,
ASOS DESIGN,Vestido corto color guinda con mangas tres cuartos acampanadas y cuello de volantes de ASOS DESIGN,"16,50 €",guinda,,
Whistles,Vestido marrón con estampado animal y vuelo de Whistles,"73,50 €",bronce,,
Miss Selfridge,Vestido camisero color rubor de pana de Miss Selfridge,"35,99 €",rubor,,
ASOS DESIGN,Vestido midi amplio con cuello fruncido y acabado de purpurina plateada de ASOS DESIGN,"21,00 €",brillantina plateada,,
ASOS DESIGN,"Vestido midi verde bosque estilo jersey con cinturón, cuello de pico y acabado muy suave de ASOS DESIGN","20,00 €",bosque,,
AllSaints,Vestido en tonos burdeos Elodie de AllSaints,"119,50 €",miel especiada,,
Vero Moda,Vestido corto amplio estampado de Vero Moda,"16,50 €",rainy day,,
Lola May,Vestido camisero corto color terracota con lazada en la cintura de Lola May,"17,50 €",terracota,,
Glamorous,Vestido midi negro amplio con estampado de florecitas y bajo plisado de Glamorous,"24,99 €",margaritas negras,,
Selected,Vestido midi amarillo con textura de Selected Femme,"61,00 €",citrico,,
Liquorish,Vestido midi gris de manga corta de Liquorish,"14,69 €",tropical,,
River Island,Vestido camisero corto negro con estampado estilo fular de River Island,"35,00 €",bufanda negra,,
Forever U,Vestido camisero con estampado de cebra de Girl In Mind,"18,75 €",cebra,,
Glamorous,Vestido midi cruzado con estampado de cerezas de Glamorous,"17,75 €",cerezas,,
Ghospell,Vestido camisero corto verde pistacho con diseño cruzado de Ghospell,"62,50 €",pistacho,,
Hollister,Vestido vaquero corto azul añil con mangas abullonadas y espalda anudada de Hollister,"29,50 €",denim color anil,,
Vero Moda,Vestido corto ajustado con detalle fruncido y estampado floral mixto de Vero Moda,"15,50 €",mezcla floral,,
Forever New Curve,"Vestido corto verde con estampado de florecitas, mangas de estilo blusón y lazada en la cintura de Forever New Curve","35,50 €",floral blush,,
Miss Selfridge,Vestido midi fruncido con estampado animal de Miss Selfridge,"30,00 €",ta1,,
ASOS Petite,"Vestido veraniego corto color rubor con bordado inglés, aberturas y volantes en los tirantes de ASOS DESIGN Petite","17,75 €",rubor,,
Object,Vestido verde con volantes Eddy de Object,"39,25 €",sombra,,
In The Style,Vestido estilo camiseta extragrande de color verde salvia efecto tie dye de In The Style,"12,95 €",sage,,
Dickies,Camiseta verde con estampado en la espalda Sandy Level de Dickies,"26,50 €",adventurine,,
Dickies,Camiseta verde oscuro con logo universitario Stephens City de Dickies,"22,00 €",adventurine,,
Dickies,Camiseta azul real con estampado del yin yang en la espalda Montross de Dickies,"26,50 €",cielo satinado,,
ASOS DESIGN,Camiseta color crudo jaspeado de corte boyfriend con detalle de bolsillo de tejido grueso de ASOS DESIGN,"19,00 €",marga cruda,,
Levi's,Camiseta azul marino con logo estampado en forma de ala de murciélago Perfect de Levi's,"19,00 €",flores kinsley,,
Levi's,Camiseta rosa con logo Poster Perfect de Levi's Plus,"25,50 €",poster cromado claro,,
Levi's,Camiseta morada con estampado de logo en forma de ala de murciélago Perfect de Levi's Plus,"21,00 €",501 logo murcielago relleno,,
Levi's,Camiseta blanca con estampado de logo en forma de ala de murciélago Perfect de Levi's Plus,"16,50 €",501 logo murcielago relleno,,
Polo Ralph Lauren,Top gris de manga larga con cuello henley de Polo Ralph Lauren,"144,50 €",brezo andover,,
ASOS Tall,Camiseta color caramelo sin mangas con cuello ancho de mezcla de algodón orgánico Ultimate de ASOS DESIGN Curve,"3,99 €",caramelo,,
