brand,description,price,colour,colour_simp,colour_simp2
Vero Moda,Vestido corto verde estilo jersey de manga larga de punto de Vero Moda,"42,99 €",dark forest,,
Lola May Curve,Vestido camisero azul petróleo con cinturón de Lola May Plus,"36,99 €",petroleo,,
Wednesday's Girl,Vestido midi morado con lazada delantera y estampado floral difuminado de Wednesday's Girl,"35,00 €",flores difuminadas,,
River Island,Vestido vaquero midi oscuro con escote palabra de honor de River Isalnd,"59,00 €",denim oscuro,,
NA-KD,Vestido largo negro y gris con diseño color block de punto de NA-KD x Moa Mattson,"61,50 €",colour block,,
Vila Curve,Vestido azul con cuello vuelto azul y lazada en la cintura de punto de Vila Curve,"35,00 €",english manor,,
Object,Vestido midi color avena sin mangas de punto de Object,"56,50 €",fossil,,
Y.A.S,Vestido midi rojo cruzado de Y.A.S,"79,99 €",hibisco,,
Y.A.S,Vestido midi rosa cruzado con estampado de cerezas de Y.A.S,"79,99 €",hibisco cereza,,
French Connection,Vestido corto naranja sin mangas de punto de French Connection,"65,99 €",calendula brillante,,
Mango,Vestido lencero midi escalonado de denim oscuro de Mango,"42,50 €",denim,,
Bolongaro Trevor,Vestido corto multicolor con estampado floral y diseño fruncido de malla de Bolongaro Trevor,"32,50 €",floral,,
Selected,Vestido largo amplio con estampado floral y mangas extragrandes de Selected Femme,"78,00 €",agua espumosa,,
Calvin Klein Jeans,Vestido color camel abotonado de tirantes de estilo worker con parche del logo de Calvin Klein Jeans,"66,50 €",shitake,,
Mango,Vestido vaquero azul medio entallado con detalle en el bajo de Mango,"30,00 €",denim,,
Lola May,Vestido corto amarillo verdoso con escote cuadrado y acabado texturizado de Lola May,"13,00 €",chartreuse,,
Cotton:On,Vestido corto rosa estilo palabra de honor de Cotton:On,"13,50 €",magenta,,
French Connection,Vestido corto con estampado floral y mangas abullonadas de algodón de French Connection,"44,00 €",floral base blanca,,
Emory Park,Vestido midi marrón de tirantes con lateral fruncido de Emory Park,"32,00 €",cacao,,
Glamorous Maternity,Vestido multicolor escalonado de manga corta y corte amplio con estampado de lunares y lazada en la espalda de Glamorous Maternity,"30,50 €",lunares arcoiris,,
Selected,Vestido largo de tirantes con estampado abstracto de satén de Selected Femme,"58,50 €",moonlite mauve,,
Glamorous,Vestido multicolor escalonado de manga corta y corte amplio con estampado de lunares y lazada en la espalda de Glamorous,"34,00 €",lunares arcoiris,,
Vero Moda,Vestido midi azul ajustado sin mangas de punto de Vero Moda,"18,50 €",campanula,,
ASOS DESIGN,Vestido veraniego corto asimétrico a cuadros de ASOS DESIGN,"31,00 €",cuadros veraniegos,,
Naked Wardrobe,Vestido corto ajustado con detalle de copas y estampado de camuflaje de Naked Wardrobe,"88,50 €",camo,,
JDY,Vestido midi rojo con abertura lateral de JDY,"14,00 €",agridulce,,
JJXX,Vestido semilargo color arena con cuello de nadadora de canalé de JJXX,"14,00 €",incienso,,
Y.A.S Petite,Vestido largo con estampado floral y cuerpo fruncido de Y.A.S Petite,"55,00 €",floral,,
JDY,Vestido midi rojo cruzado con estampado floral de JDY,"22,50 €",agridulce,,
Only Petite,Vestido midi azul de tirantes con estampado de margaritas y abertura lateral exclusivo de Only Petite,"16,50 €",cielo claro,,
Only Tall,Vestido midi azul de tirantes con estampado de margaritas y abertura lateral exclusivo de Only Tall,"20,00 €",cielo claro,,
Levi's,Vestido corto verde estilo polo con ribetes en contraste de Levi's,"47,00 €",eden,,
JJXX,Vestido camisero corto naranja luminoso con detalle de abertura de JJXX,"24,50 €",puffins bill,,
ASOS Maternity,Vestido midi rosa polvoriento con cuello de nadadora de punto de ASOS DESIGN Maternity,"24,50 €",dusty rose,,
ASOS DESIGN,Vestido largo amarillo verdoso con escote palabra de honor de ASOS DESIGN,"22,50 €",chartreuse,,
ASOS DESIGN,Vestido de tarde estilo babydoll con estampado de cebra abstracto y cintura ceñida de ASOS DESIGN,"26,50 €",cebra abstracto,,
ASOS DESIGN,Vestido midi color terracota sin mangas con cuello redondo y falda anudada tipo pareo de ASOS DESIGN,"24,50 €",terracota,,
ASOS DESIGN,Vestido midi color crema con cuello de pico de croché de ASOS DESIGN,"32,50 €",nata,,
ASOS DESIGN,Vestido corto color canela con mangas murciélago plisadas y aberturas de ASOS DESIGN,"26,50 €",canela,,
ASOS DESIGN,Vestido corto color latte de tirantes retorcidos con escote cuadrado de canalé de ASOS DESIGN,"21,00 €",cafe con leche,,
Free People,Vestido corto azul río amplio con estampado floral de Free People,"114,00 €",combinacion rio,,
French Connection,Vestido corto caqui de corte evasé acanalado de French Connection,"103,99 €",musgo oscuro,,
Miss Selfridge,"Vestido lencero midi en tonos luminosos con estampado floral, bajo fruncido y detalles de volantes de Miss Selfridge Petite","17,00 €",conglomerado floral,,
The Frolic Plus,"Vestido corto multicolor con estampado floral efecto acuarela, mangas abullonadas y pecho fruncido de The Frolic Plus","32,50 €",floral acuarela,,
The Frolic,"Vestido corto multicolor con estampado floral efecto acuarela, mangas abullonadas y pecho fruncido de The Frolic","32,50 €",floral acuarela,,
The Frolic Plus,"Vestido largo multicolor con estampado floral tipo acuarela, cuello ancho y volantes de The Frolic Plus","49,00 €",floral acuarela,,
Free People,Vestido largo multicolor cruzado con estampado floral de Free People,"123,50 €",combinacion neutra,,
ASOS DESIGN,"Vestido largo a cuadros vichy naranjas con margaritas, escote cuadrado y espalda cruzada de ASOS DESIGN","36,00 €",cuadros vichy con margaritas,,
Cotton:On,Vestido camisero corto azul escalonado y suelto a cuadros vichy de Cotton:On Maternity,"29,00 €",cuadros vichy,,
ASOS DESIGN,"Vestido midi de tirantes con detalle calado de encaje, dos aberturas hasta el muslo y estampado floral vintage de ASOS DESIGN","29,00 €",flores vintage,,
ASOS Tall,Vestido midi blanco cruzado y escalonado de manga corta con estampado de lunares de ASOS DESIGN Tall,"30,00 €",base blanca con lunares,,
Native Youth,Vestido semilargo a cuadros vichy de colores de corte trapecio extragrande de Native Youth,"38,50 €",cuadros vichy extragrandes,,
Native Youth Plus,Vestido semilargo a cuadros vichy de colores de corte trapecio extragrande de Native Youth Plus,"38,50 €",cuadros vichy extragrandes,,
The Frolic,Vestido corto de tirantes con detalle de copas y estampado floral pastel de lino de The Frolic,"29,00 €",flores pastel,,
The Frolic,Vestido corto de estilo mesonera con estampado floral vintage y abertura en el cuerpo de The Frolic,"33,50 €",flores vintage,,
Daisy Street Plus,Vestido corto a rayas arcoíris de corte amplio de lino de Daisy Street Plus,"39,50 €",lino arcoiris,,
Daisy Street,Vestido corto multicolor a rayas de corte amplio de lino de Daisy Street,"39,50 €",lino arcoiris,,
French Connection,Vestido ajustado con estampado de cebra de punto Manhatten de French Connection,"62,99 €",cebra,,
Lee Jeans,Vestido camisero vaquero corto con lavado claro de Lee,"87,99 €",lavado claro,,
ASOS Petite,"Vestido corto con escote cuadrado, cinturón y estampado floral retro de sarga de ASOS DESIGN Petite","30,00 €",floral retro,,
ASOS DESIGN,Vestido largo color vainilla de manga larga de croché de ASOS DESIGN,"34,00 €",nata,,
Miss Selfridge,Vestido midi color moca con lavado ácido de Miss Selfridge,"22,50 €",turron,,
The Frolic,"Vestido midi con estampado floral vintage, cuerpo fruncido y tirantes anudados de The Frolic","38,50 €",flores vintage,,
ASOS DESIGN,Vestido midi negro cruzado y escalonado de manga corta con estampado de lunares de ASOS DESIGN,"30,00 €",base negra con lunares,,
ASOS DESIGN,"Vestido midi rojo plisado con escote cuadrado, manga abombada y estampado de margaritas de ASOS DESIGN","36,00 €",margaritas rojas,,
Bolongaro Trevor,Vestido camisero corto color baya de terciopelo de Bolongaro Trevor,"76,99 €",arandano,,
ASOS Curve,Vestido midi blanco de manga corta cruzado con diseño escalonado y estampado de lunares de ASOS DESIGN Curve,"30,00 €",base blanca con lunares,,
French Connection,Vestido midi beis estilo cárdigan de French Connection,"82,99 €",sabbia,,
French Connection,Vestido midi rosa con abertura lateral de punto de French Connection,"62,99 €",fuchsia,,
Only Curve,Vestido camisero corto naranja de Only Curve,"36,99 €",tigerlily,,
ASOS DESIGN,Vestido veraniego midi de tirantes con diseño fruncido suave y estampado floral desdibujado de ASOS DESIGN,"21,50 €",flores difuminadas,,
Signature 8,Vestido vaquero corto con lavado medio y cuello halter de Signature 8,"33,00 €",lavado medio,,
ASOS Curve,Vestido midi de manga larga con estampado de cebra y diseño enrejado en la espalda de malla de ASOS DESIGN Curve,"40,00 €",cebra,,
ASOS Tall,Vestido midi verde pistacho fruncido con bajo asimétrico de tejido texturizado de ASOS DESIGN Tall,"42,50 €",pistacho,,
Never Fully Dressed,Vestido lencero con estampado de cachemir de satén de Never Fully Dressed,"87,50 €",cachemir,,
Dr Denim,Vestido corto marrón con cremallera de punto de Dr Denim,"60,00 €",nuez,,
Dr Denim,Vestido corto negro con cremallera de punto de Dr Denim,"52,00 €",grafito,,
Dr Denim Plus,Vestido estilo pichi color carbón holgado de Dr Denim Plus,"57,50 €",grafito lavado,,
ASOS DESIGN,Vestido midi verde pistacho fruncido con bajo asimétrico de tejido texturizado de ASOS DESIGN,"42,50 €",pistacho,,
Y.A.S Petite,Vestido midi color crema amplio con cuerpo fruncido y bordado floral de Y.A.S Petite,"90,00 €",macadamia,,
ASOS DESIGN,Vestido corto de manga larga con estampado floral de estilo grunge y volantes en el bajo de chifón de ASOS DESIGN,"28,00 €",floral grunge,,
Annorlunda,Vestido corto azul multicolor con detalle de lazada y estampado efecto piel de lagarto luminoso de Annorlunda,"43,00 €",reptil luminoso,,
Annorlunda,Vestido largo azul con estampado multicolor estilo piel de lagarto con detalle de ribetes de malla de Annorlunda,"57,50 €",reptil luminoso,,
Annorlunda,Vestido semilargo multicolor asimétrico con estampado de lunares combados y diseño fruncido de Annorlunda,"55,00 €",lunares degradados combados,,
Wednesday's Girl Maternity,Vestido de tarde corto con diseño de flores estilo patchwork y detalle de volantes de Wednesday's Girl Maternity,"28,00 €",flores patchwork,,
Wednesday's Girl,Vestido de tarde corto con diseño de flores estilo patchwork y detalle de volantes de Wednesday's Girl,"28,00 €",flores patchwork,,
Object,Vestido midi azul abotonado con detalle de aberturas de Object,"58,00 €",provenza,,
Emory Park,Vestido largo color coñac ceñido de punto de hilos mezclados de Emory Park,"40,00 €",conac,,
ONLY,Vestido verde de corte skater y manga corta de Only,"23,99 €",mermaid,,
Annorlunda,Vestido largo multicolor con estampado de lava y ribete de círculos de malla de Annorlunda,"66,00 €",lava,,
Glamorous,Vestido de tarde corto negro con estampado de margaritas y cuello de pico de Glamorous,"31,00 €",margaritas negras,,
Glamorous Curve,Vestido de tarde corto negro con estampado de margaritas y cuello de pico de Glamorous Curve,"29,00 €",margaritas negras,,
The Frolic,Vestido corto multicolor plisado con estampado floral lavado y volantes de The Frolic,"32,50 €",floral lavado,,
Object,Vestido midi marrón de manga larga con estampado abstracto de Object,"50,50 €",humus,,
Whistles,Vestido camisero midi color cerceta con estampado de tigre y lazada en la parte delantera de Whistles,"75,50 €",tigre cerceta,,
Calvin Klein Jeans,Vestido vaquero de corte cuadrado con lavado medio y logo central de Calvin Klein Jeans,"70,00 €",denim oscuro,,
Miss Selfridge,Vestido de tarde corto con diseño patchwork de florecitas y solapas de Miss Selfridge Petite,"32,00 €",lunares estilo patchwork,,
AFRM,Vestido corto multicolor de manga larga con cuello halter de pico y aberturas laterales de AFRM,"46,50 €",jardin nocturno neon,,
AFRM,Vestido midi con cordones y estampado de florecitas de malla de AFRM,"33,50 €",jardin nocturno neon,,
Free People,Vestido azul marino y gris de tirantes con ribete de encaje de Free People,"85,00 €",combinacion jazzberry,,
Mama.licious,Vestido camisero midi caqui de Mamalicious Maternity,"41,99 €",hiedra trepadora,,
JDY,Vestido camisero verde de satén con botones de strass Klara de JDY,"21,00 €",escarabajo,,
Pieces,Vestido camisero azul marino Shia de Pieces,"32,99 €",night sky,,
Free People,Vestido corto morado de estilo bohemio con estampado floral y cuello de pico de Free People,"92,50 €",night combo,,
ONLY,Vestido azul marino a rayas de corte skater y manga corta de Only,"17,00 €",night sky,,
Rebellious Fashion,Vestido corto amplio con estampado de cebra de Rebellious Fashion,"24,99 €",cebra,,
Pieces,Vestido beis con cuello alto de punto de Pieces,"38,99 €",fossil,,
M Lounge,Vestido largo azul marino francés de tejido cálido de M Lounge,"51,50 €",french navy,,
JDY,Vestido corto gris con lazada en la cintura de punto Donsy de JDY,"24,99 €",lgm,,
ONLY,Vestido skater a rayas verdes de manga corta de Only,"23,99 €",mermaid,,
ONLY,Vestido midi turquesa con diseño a rayas de Only,"34,99 €",blarney,,
Simply Be,Vestido midi negro estampado de malla de Simply Be,"36,00 €",mixto,,
ASOS DESIGN,Vestido camisero corto con estampado de ondas y mangas raglán de sarga de ASOS DESIGN,"34,50 €",diseno ondulado,,
Nobody's Child,Vestido midi de manga larga con estampado de lunares luminosos Siri de Nobody's Child,"43,00 €",lunares luminosos,,
JDY,Vestido verde estilo sudadera Alexandra de JDY,"19,00 €",atlantico norte,,
JDY,Vestido corto rosa de punto Charly de JDY,"38,99 €",palisandro,,
ASOS DESIGN,Vestido corto con estampado de cebra difuminado y mangas acampanadas de ASOS DESIGN,"15,00 €",cebra difuminada,,
Fire & Glory,Vestido verde estilo camiseta con cuello alto Alicia de Fire & Glory,"12,50 €",citron oscuro,,
Mama.licious,Vestido corto marrón de lactancia con volantes en el cuello y diseño funcional efecto 2 capas de punto de Mamalicious Maternity,"35,00 €",capuchino,,
Threadbare Petite,Vestido midi color sangría con botones de punto Elm de Threadbare Petite,"22,00 €",sangria,,
Fire & Glory,Vestido midi marrón ajustado de Fire & Glory,"15,00 €",chicory coffee,,
Pretty Lavish,Vestido camisero semilargo color ostra abotonado de Pretty Lavish,"76,00 €",ostra,,
Tommy Jeans,Vestido rojo estilo camiseta con hombro descubierto y logo de estilo universitario exclusivo de Tommy Jeans x ASOS,"58,50 €",carmesi,,
Barbour,Vestido camisero a cuadros Lorna exclusivo de Barbour x ASOS,"64,00 €",cuadros,,
ASOS Curve,"Vestido largo a cuadros vichy naranjas con estampado de margaritas, escote cuadrado y espalda cruzada de ASOS DESIGN Curve","29,00 €",cuadros vichy con margaritas,,
Noisy May,Vestido corto verde lima con detalle de lazada de Noisy May,"10,50 €",mariposa,,
ASOS Curve,Vestido midi lila y rojo cruzado con estampado estilo patchwork y cinturón de ASOS DESIGN Curve,"20,00 €",patchwork,,
Levi's,Vestido estilo wéstern con lavado oscuro de Levi's,"80,50 €",lavado anil,,
Free People,Vestido midi color marfil con bordado de flores de cactus de Free People,"177,50 €",combinacion lazy bones,,
Pieces,Vestido azul con capucha de punto Ribbi de Pieces,"20,00 €",ultramarino profundo,,
ASOS Curve,Vestido midi monocromático plisado de manga larga con detalle en el pecho y estampado de margaritas de ASOS DESIGN Curve,"33,50 €",margaritas monocolor,,
Glamorous Petite,Vestido midi estilo mesonera con mangas abullonadas y estampado de cerezas de Glamorous Petite,"39,50 €",cerezas,,
Vila,Vestido midi monocromático amplio con estampado floral llamativo de Vila,"20,00 €",flores monocromaticas,,
Aligne,Vestido camisero corto con estampado floral vintage y detalle de volantes de algodón orgánico de Aligne,"25,99 €",flores vintage,,
Topshop,Vestido midi azul cobalto amplio sin mangas de satén premium de Topshop,"23,00 €",cobalto,,
Only Curve,Vestido largo negro con estampado de cuadros dameros y flores de Only Curve,"20,00 €",floral,,
Glamorous Petite,"Vestido corto en tonos pastel escalonado con estampado de margaritas, mangas abullonadas y lazada en la espalda de Glamorous Petite","14,00 €",margaritas pastel,,
In Wear,Vestido rosa melón amplio a cuadros Vanida de In Wear,"57,50 €",melon,,
Noisy May,Vestido corto beis de tirantes con laterales fruncidos de punto de Noisy May,"14,00 €",cepillo,,
In Wear,Vestido midi color crema con cuello de pico de punto grueso Issa de In Wear,"54,00 €",whisper,,
ASOS DESIGN,"Vestido de tarde corto negro con estampado floral, falda de godets y lazada delantera de ASOS DESIGN","12,00 €",base negra floral,,
Noisy May,Vestido multicolor de manga corta con cuello tipo polo de Noisy May,"24,00 €",lava fundida,,
ASOS Petite,"Vestido corto rojo plisado con estampado de margaritas, mangas acampanadas y detalle de botones de ASOS DESIGN Petite","21,00 €",margaritas rojas,,
ASOS DESIGN,Vestido midi negro plisado con estampado floral y detalle anudado de ASOS DESIGN,"21,00 €",efecto tie dye,,
French Connection,Vestido de tarde midi negro con estampado de estrellas de French Connection,"50,00 €",estrella negra,,
ASOS DESIGN,"Vestido de tarde corto blanco con estampado floral multicolor, abertura triangular y detalle de botones de ASOS DESIGN","14,50 €",floral con base blanca,,
ASOS DESIGN,Vestido midi lila y rojo cruzado con estampado de patchwork y cinturón de ASOS DESIGN,"37,00 €",patchwork,,
The Frolic,Vestido corto negro y rosa con mangas voluminosas y diseño floral de jacquard de The Frolic,"29,50 €",jacquard floral,,
Pieces,Vestido corto caqui amplio con bajo asimétrico Darala de Pieces,"17,50 €",tortuga marina,,
Parallel Lines,Vestido corto color terracota con aberturas y mangas abullonadas de Parallel Lines,"23,50 €",terracota,,
In Wear,Vestido amarillo amplio con vuelo Monisha de In Wear,"117,99 €",anise,,
Bailey Rose,Vestido corto a rayas rosas con abertura y detalle retorcido en el busto de punto de Bailey Rose,"31,50 €",uva,,
Whistles,Vestido corto azul con solapas de cambray de Whistles,"61,00 €",denim,,
Vero Moda,Vestido corto rojo luminoso estampado con mangas abullonadas y escote cuadrado de Vero Moda,"14,00 €",escarlata vivo,,
ASOS Petite,Vestido veraniego de tirantes con estampado retro y escote cuadrado de ASOS DESIGN Petite,"13,00 €",floral retro,,
ASOS DESIGN,Vestido corto rosa estilo palabra de honor con estampado floral abstracto de satén de ASOS DESIGN,"11,00 €",floral abstracto,,
LOLA MAY TALL,Vestido camisero amarillo verdoso con bajo asimétrico de Lola May Tall,"20,00 €",chartreuse,,
LOLA MAY PETITE,Vestido midi amplio con estampado de lunares y pecho fruncido de Lola May Petite,"33,99 €",rubor,,
ASOS Curve,Vestido midi amplio de manga larga con estampado floral extragrande de chifón de ASOS DESIGN Curve,"38,00 €",floral extragrande,,
Nobody's Child,Vestido largo con mangas fruncidas y estampado otoñal de florecitas de Nobody's Child,"43,50 €",flores otonales,,
ASOS DESIGN,Vestido corto a cuadros verdes y rosas de corte amplio con diseño cruzado de ASOS DESIGN,"13,50 €",cuadros,,
ASOS EDITION,Vestido camisero corto amarillo caléndula con hombreras de ASOS EDITION,"36,50 €",calendula,,
Pieces,Vestido corto azul amplio con bajo caído Darala de Pieces,"14,50 €",sunlit allium,,
I Saw It First,Vestido azul cobalto de corte amplio con volantes en las mangas de I Saw It First,"12,00 €",cobalto,,
Glamorous,Vestido corto rojo cruzado con estampado floral de Glamorous,"24,50 €",base roja con margaritas,,
Glamorous Curve,Vestido corto rojo cruzado con estampado floral de Glamorous Curve,"26,50 €",base roja con margaritas,,
Glamorous Bloom,Vestido corto rojo cruzado con estampado floral de Glamorous Bloom,"24,50 €",base roja con margaritas,,
ASOS DESIGN,Vestido corto de manga corta de malla con estampado floral difuminado y detalle de encaje de ASOS DESIGN,"21,50 €",flores difuminadas,,
Wednesday's Girl Curve,Vestido midi a cuadros vichy luminosos de corte amplio con falda escalonada y mangas abullonadas de Wednesday's Girl Curve,"17,50 €",cuadros vichy luminosos,,
Wednesday's Girl,Vestido midi a cuadros vichy luminosos de corte amplio con falda escalonada y mangas abullonadas de Wednesday's Girl,"13,00 €",cuadros vichy luminosos,,
ASOS Curve,Vestido de tarde midi de manga corta con busto fruncido y estampado floral en tonos pastel de ASOS DESIGN Curve,"15,00 €",flores tono pastel,,
ONLY,Vestido corto caqui cruzado de Only,"34,99 €",kalamata,,
Object,Vestido verde cruzado con diseño estampado multicolor Elli de Object,"62,99 €",hierba marina,,
Miss Selfridge,Vestido estilo palabra de honor con lavado descolorido Rara de Miss Selfridge,"13,00 €",lavado descolorido,,
Reclaimed Vintage,Vestido corto de tirantes con estampado geométrico estilo fular de satén de Reclaimed Vintage Inspired,"13,00 €",geometrico,,
ASOS Curve,"Vestido veraniego midi color pastel con estampado floral, lateral fruncido y cuello desbocado de ASOS DESIGN Curve","18,89 €",flores tono pastel,,
Polo Ralph Lauren,Vestido gris con capucha de punto de Polo Ralph Lauren,"172,00 €",brezo andover,,
Wednesday's Girl,Vestido de tarde midi blanco estilo mesonera con estampado floral de Wednesday's Girl,"19,00 €",floral base blanca,,
Glamorous,"Vestido corto en tonos pastel escalonado con estampado de margaritas, mangas abullonadas y lazada en la espalda de Glamorous","20,50 €",margaritas pastel,,
ASOS DESIGN,"Vestido veraniego corto con estampado de remolinos abstractos, cintura fruncida y diseño de tiras en la espalda de ASOS DESIGN","15,74 €",abstract swirl,,
ASOS DESIGN,Vestido corto escalonado con estampado floral abstracto y detalle retorcido en la parte delantera de voile de ASOS DESIGN,"29,00 €",tenido anudado,,
ASOS DESIGN,Vestido camisero largo con estampado floral de sarga de ASOS DESIGN,"43,50 €",floral base blanca,,
ASOS DESIGN,Vestido midi rosa ajustado con detalle ondulado y estampado floral difuminado de ASOS DESIGN,"20,24 €",flores difuminadas,,
Little Mistress,Vestido midi escalonado con estampado de lunares de Little Mistress,"16,00 €",lunares,,
Zemeta,Vestido corto amplio con mangas abullonadas y cuello tipo babero con querubines estampados de Zemeta,"64,50 €",escoces,,
Zemeta,Vestido midi de tirantes amplio y escalonado con calentadores a juego de Zemeta,"62,00 €",escoces,,
ASOS DESIGN,Vestido largo color mandarina con cuello cruzado y abertura hasta el muslo de ASOS DESIGN,"22,00 €",mandarina,,
Glamorous Petite,"Vestido de tarde en tonos pastel de manga larga con estampado floral, cuello de pico y lazada en la cintura de Glamorous Petite","24,50 €",flores tono pastel,,
Heartbreak,Vestido corto verde pistacho con aberturas y cuello halter de Heartbreak,"12,50 €",pistacho,,
ASOS Curve,Vestido corto a cuadros verdes y rosas de corte amplio con diseño cruzado de ASOS DESIGN Curve,"20,00 €",cuadros,,
Motel,Vestido corto amarillo con estampado floral grunge y botones de Motel,"25,50 €",florecillas primaverales amarillas,,
ASOS Curve,"Vestido veraniego largo con cuello ancho, abertura y estampado floral retro de lino de ASOS DESIGN Curve","22,00 €",floral retro,,
ASOS DESIGN,Vestido lencero corto con escote cuadrado y estampado de flores y cuadros vichy de ASOS DESIGN,"11,50 €",vichy floral,,
Vero Moda,Vestido rojo de manga larga con diseño de tiras de Vero Moda,"14,00 €",escarlata vivo,,
Replay,Vestido color arena con bajo redondeado de canalé de Replay,"49,50 €",lodo,,
Vila,Vestido corto azul claro de corte recto y manga larga con diseño estampado y cinturón de Vila,"18,00 €",english manor,,
Vila,Vestido corto beis escalonado estilo túnica con cuello de pico de Vila,"21,00 €",cemento,,
Public Desire Curve,Vestido corto rojo estilo polo de Public Desire Curve,"19,00 €",scarlet,,
ASOS Petite,Vestido corto verde salvia de corte skater con escote cuadrado y estampado de lunares de ASOS DESIGN Petite,"10,00 €",lunares,,
In Wear,Vestido camisero lila vaporoso con estampado gráfico de In Wear,"79,50 €",sombreado,,
ASOS Curve,Vestido de tarde midi de manga corta con estampado floral variado y detalle de lazada de ASOS DESIGN Curve,"21,00 €",mezcla floral,,
Levi's,Vestido midi con estampado de cebra ondulado de Levi's,"30,00 €",creme brulee,,
Emory Park,Vestido corto terracota con cintura fruncida de Emory Park,"14,00 €",salmon,,
Vero Moda Petite,Vestido midi lila con detalle de costuras estilo corsé y cuello ancho de Vero Moda Petite,"24,00 €",lavandula,,
Vila,Vestido beis con mangas 3/4 de malla de Vila,"44,99 €",nomad,,
ASOS DESIGN,Vestido corto de corte skater con godets y estampado de cuadros vichy y flores de ASOS DESIGN,"13,00 €",vichy floral,,
The Frolic,Vestido corto multicolor con vuelo y estampado de cuadros vichy y flores de The Frolic,"23,50 €",vichy floral,,
Topshop,Vestido vaquero descolorido de tirantes de estilo años 90 de Topshop,"21,00 €",descolorido,,
Whistles,Vestido corto azul amplio de cambray Tilly de Whistles,"41,50 €",vaqueros,,
Y.A.S,Vestido midi azul con detalle fruncido en el pecho de popelina de algodón exclusivo de Y.A.S,"14,00 €",paraiso isleno,,
Edited,Vestido amplio de manga corta con estampado floral retro y bajo plisado de algodón de EDITED - MULTI,"30,00 €",floral retro,,
Envii,Vestido corto cruzado con mangas globo y estampado retro de girasoles de Envii,"32,19 €",amapolas doradas,,
Pieces Tall,Vestido amplio con estampado de florecitas y cuello de pico exclusivo de Pieces Tall,"16,19 €",floral,,
Forever New,Vestido corto color porcelana con mangas abullonadas de Forever New,"39,00 €",porcelain,,
